title,price,loc,link,desc,date
2 værelses lejlighed på 65 m²,11200,"København S, Richard MortensensVej",https://www.boligportal.dk/lejebolig/dp/2-vaerelses-lejlighed-koebenhavn-s/id-6046632,"Lejligheden

Lejligheden fremstår lys og indbydende. Den er opført i klassiske, tidssvarende materialer. Fra entreen er der adgang til badeværelse med gulvvarme, indbyggede spots, separat bruseniche og vaskesøjle. Endvidere er der adgang til et værelse med hvide skabe og mulighed for opbevaring. Køkkenet, som er opført i lyse materialer, byder på masser af skabsplads, indbyggede hårde hvidevarer og ligger i forlængelse af stuen. Stuen er med sit vidunderlige lysindfald, en god ramme for hverdagslivet. Det er muligt at ansøge om husdyrtilladelse i alle vores lejemål.

NB: billederne viser ikke den eksakte lejlighed, men er i stedet billeder fra en lejlighed med samme planløsning og i samme stand. Der kan forekomme mindre variationer i vindues-, altan- og radiatorplaceringer mellem boliger af samme type. Desuden kan udsigten variere, hvis typebilledet er taget fra en etage lidt højere oppe eller længere nede end den pågældende lejlighed. Derfor kræver vi altid, at du skal med ud på en fremvisning inden du kan underskrive en lejekontrakt, så du er helt sikker på, hvad du får.

Ejendom 

Hesteskoen, der er opført i 2015, har fået sit navn efter de tre karréer, som er placeret i en hestesko, der åbner op mod Kalvebod Fælled og sørger for, at alle lejligheder har udsigt mod det grønne. Bygningens konstruktion er simpel i sin grundform, men altanernes varierede placering tilfører strukturen en dynamisk karakter. Samtidig sikres gode lysforhold til alle lejligheder. Samlingspunktet er et stort, fælles gårdmiljø med plads til både udfoldelse, ophold og leg. Og så er der direkte adgang til sø og egen bådebro, hvorfra det er muligt at sejle kajak. Ejendommen byder desuden også på bl.a. elevator, dørtelefon, affaldsskakt og mulighed for aflåst cykelparkering i kælderen. Der er desuden opført parkeringshus i forlængelse af ejendommen, med mulighed for at leje p-plads (skal dog lejes gennem By&Havn og ikke Balder). 

Omgivelser

Ørestad Syd er Københavns nye grønne bydel omgivet af natur og vand - og med en god blanding af boliger, erhverv, uddannelse og kultur. Området er kendetegnet ved sammenstødet mellem moderne arkitektur og Kalvebod Fælleds vidtstrakte natur. Kvarteret er i konstant udvikling og de tusindvis af nye beboere er med til at gøre Ørestad Syd til en bydel fuld af liv og aktivitet. Selvom den fredede natur ligger lige i baghaven, er man som beboer i Ørestad Syd meget tæt på Københavns midte og puls. På cykel eller med metro kan du være på Christianshavn på 11 minutter eller på Nørreport St. på 14 minutter. I Ørestad Syd har du dog adgang til alt hvad hjertet begærer, uden at forlade kvarteret. Foruden den storslåede natur, har du Danmarks største shopping center, Field’s, store kulturoplevelser i Royal Arena, caféliv, sportsklubber, skoler, børnehaver og indkøbsmuligheder lige uden for døren.",2020-10-20T12:37:33Z
2 værelses lejlighed på 65 m²,13000,"København S, Amager Strandvej",https://www.boligportal.dk/lejebolig/dp/2-vaerelses-lejlighed-koebenhavn-s/id-6046532,"Vil du bo bynært og med stranden som din baghave, så er no130 det helt rigtige valg. De 76 arkitekttegnede lejligheder har en fantastisk udsigt over Øresund og Amager Strandpark. Den kystnære beliggenhed giver en usandsynlig smuk udsigt fra stort set alle lejligheder.

De eksklusive lejligheder er designet af Holscher Nordberg Arkitekter med en helt særlig detalje for øje: Der skal være en smuk udsigt fra næsten alle lejligheder – og altså ikke kun en god udsigt for dem på første række. Alle lejligheder har oven i købet egen altan, terrasse eller tagterrasse til de hyggelige sommeraftener.

Kvalitet i højsædet:

De eksklusive, arkitekttegnede boliger er etableret i en høj bygningsmæssig kvalitet med gennemtænkte detaljer – fra lækkert badeværelse til flot og funktionelt køkken.

Flot, åbent køkken, der indbyder til hygge:

Der er lagt vægt på gennemgående kvalitetsmaterialer. Køkkenet fremstår lyst, flot, åbent og elegant. Køkkenbordene har store, sorte granitoverflader. Om det er til de lange sommeraftener eller hyggelige vinterstunder, så er alle boliger udstyret med en smart Quooker, så du altid nemt kan få koldt, varmt eller kogende vand fra én hane.

Bemærk: Billederne er taget fra vores prøvelejlighed.

Lejevilkår:

Depositum: 3 måneders husleje

Forudbetalt leje husleje: 1 måneder + første måneds leje inkl. forbrug.

Lejeperiode: Ubegrænset leje

Min. lejeperiode: 12 måneder + 3 måneders opsigelsesperiode

Lejestigning: Lejestigning ifølge nettoprisindeks

Husdyr: 1 mindre husdyr tilladt mod udlejers tilladelse

Bemærk: Der må max. stå 2 lejere på lejekontrakten.

Lejlighederne må max. beboes af det antal voksne der er beboelsesrum til.",2020-10-20T12:37:33Z
2 værelses lejlighed på 54 m²,11000,"København S, Doris Lessings Vej",https://www.boligportal.dk/lejebolig/dp/2-vaerelses-lejlighed-koebenhavn-s/id-6046395,"Ejendommen
Nadinehus består 141 lejligheder.  Enkelte af lejlighederne har egen tagterrasse, og ellers kan man samles med venner og familie på 3.  sal i den vestlige del af ejendommen, hvor der er en stor fælles tagterrasse. 
 
Lejlighederne
Boligerne i Nadinehus er rummelige og møblerbare med lange kig på langs og tværs i lejlighederne.  Materialerne er lyse og imødekommende med et minimalistisk udtryk.  Alle lejlighederne har adgang til egen eller spansk altan. 
 
Området
Inden for 5 minutters gang ligger Metro St. , gode indkøbsmuligheder, Byparken mm.  Derudover har du skole, gymnasium og Amagerfælled inden for 1 kilometer.",2020-10-20T12:37:33Z
3 værelses lejlighed på 97 m²,11495,"København S, Edvard Thomsens Vej",https://www.boligportal.dk/lejebolig/dp/3-vaerelses-lejlighed-koebenhavn-s/id-6046048,"De eksklusive lejligheder i ejendommen Puls, stod færdige 1. januar 2013. Den veldisponerede lejlighed har åbent og rummeligt køkken-alrum udført i lækre materialer af meget høj kvalitet. Badeværelset er kendetegnet ved kvalitet i særklasse samtidig med, at de er funktionelle og med rigtig god plads.Lejligheden har solrig altan, og er placeret med optimalt lysindfald. I ejendommens stueetage bliver der bygget en Irma og en cafe.Lejlighederne ligger midt i Ørestad, der er præget af liv og energi. Børnehave, vuggestue, skole og universitet er lige i nærheden, og områdets veludviklede infrastruktur betyder, at metro, togstation og motorvejspåkørsel kun ligger få minutter fra ejendommen. Lufthavnen er blot 10 minutters kørsel væk og kan nemt nås med toget med kun to stop fra Ørestad.Derudover ligger ejendommen tæt på Field's samt attraktive og fredede grønne områder, herunder Amager Fælled, golfbane og Amager Strand",2020-10-20T12:37:33Z
3 værelses lejlighed på 90 m²,12500,"København S, Else Alfelts Vej",https://www.boligportal.dk/lejebolig/dp/3-vaerelses-lejlighed-koebenhavn-s/id-6045845,"Lejligheden

Lejligheden er indrettet med et stort alrum, hvor køkken og stue smelter sammen og skaber en rummelig atmosfære. De store vinduespartier trækker lys ind i lejligheden fra alle vinkler. Dertil er boligen udstyret med et moderne køkken fra Invita, hårde hvidevarer fra Bosch Siemens samt praktisk skabsplads i mastersoveværelset. Fra gangen har du adgang til det rummelige og indbydende badeværelse med gulvvarme, formstøbt marmorvask, væghængt toilet samt vaskesøjle. Fra stuen har du udgang til en stor møblérbar altan, der giver et privat pusterum med masser af sol, frisk luft og hygge. Det er muligt at ansøge om husdyrtilladelse i alle vores lejemål.

NB: da Bastionen er et nybyggeri, står alle lejemål ikke helt færdigbygget endnu. Billederne viser derfor ikke den pågældende lejlighed, men i stedet billeder fra prøveboligen. Billeder kan derfor bruges til at få en fornemmelse af stil og materialevalg. Ift. planløsning, henviser vi til plantegningen. Kom gerne forbi til et åbent hus eller ring og book en personlig fremvisning. Såfremt byggeprocessen er nået langt nok, kan vi nogle gange fremvise specifikke lejligheder udover blot prøveboligen.

Ejendommen

Bastionen er et spændende byggeri med en stærk arkitektonisk identitet, tegnet af de prisvindende arkitekter Danielsen Architecture. Her bydes du velkommen af de karakteristiske hængende haver der pryder ejendommens facade og leder ind i den grønne gårdhave. Den unikke beplantning fra det nærliggende Kalvebod Fælled er trukket ind i både gårdrum og på altaner, og er med til at mildne vinden og skabe en grøn oase. Det sydvestlige hjørne af Bastionen er bevidst bygget lavere end bygningens andre hjørner for at trække sol ind i gårdrummet og give mest mulig udsigt til den omkringliggende natur i Skovrummet og Fælleden. Det sænkede hjørne i den sydvestlige del af bygningen betyder også, at lejlighederne gennemstrømmes af dagslys. Gårdrummets frodige og varierende beplantning skaber både afslappende hyggekroge og perfekte naturlige legeomgivelser med høje klatretræer, små bakker og enggræs til gemmeleg. Gårdrummet byder også på et væksthus, en basketball bane samt et overdækket område til cykelparkering. Til ejendommen hører der desuden elevator, dørtelefon med kamera og mulighed for parkeringsplads i kælderen.

Omgivelser

Ørestad Syd er Københavns nye grønne bydel der ligger i grænselandet mellem natur og storby. Bydelen er præget af spændende og moderne byggerier tegnet af anerkendte danske og internationale arkitekter. Som beboer i Ørestad Syd har man Kalvebod Fælled lige uden for døren. Fælleden byder på enestående naturomgivelser med masser af plads til både løb, cykling, ridning, drageflyvning, rulleskøjteløb eller bare helt stille og rolige gåture. Dertil rummer Ørestad også masser af spisesteder samt et aktivt byliv og kulturelt miljø. Her bor du i gåafstand til både shopping i Field’s, store kulturelle og sportslige begivenheder i Royal Arena, adskillige sportsklubber og et enestående friluftsliv. Bastionen er også optimalt placeret i forhold til daginstitutioner, skoler, gymnasier og videregående uddannelser – og med metroen lige rundt og hjørnet kan du være på Kongens Nytorv på bare 14 minutter.",2020-10-20T12:37:33Z
2 værelses lejlighed på 89 m²,10300,"København N, Mimersgade",https://www.boligportal.dk/lejebolig/dp/2-vaerelses-lejlighed-koebenhavn-n/id-6045678,"2 vær. lejlighed beliggende på Mimersgade, Nørrebro Lejligheden er velindrettet, med entré, stue, soveværelse, flisebadeværelse med bruseniche og nyere køkken med nye hårdehvidevare (komfur, emhætte, køle/fryse skab, opvaskemaskine) . I alle opholdsrum er der lyst parketgulv. Endvidere er der fælles vaskerum og fælles taghave. Lejligheden lejes ikke ud til dele-lejlighed og der må ikke holdes husdyr.",2020-10-20T12:37:33Z
2 værelses lejlighed på 81 m²,12800,"København S, Weidekampsgade",https://www.boligportal.dk/lejebolig/dp/2-vaerelses-lejlighed-koebenhavn-s/id-6045475,"Stor 2 værelses lejlighed på 3 sal i nyere ejendom på Islands Brygge.

Stor stue med køkken og udgang til altan. Derudover 2 vinduer som fransk altan med skydedøre.

Ligger meget tæt på havneløbet og kort gåafstand til butikker og busruter/Metro

Parkering i ejendommens kælder kan lejes separat.",2020-10-20T12:37:33Z
3 værelses lejlighed på 97 m²,12595,"København S, C F Møllers Allé",https://www.boligportal.dk/lejebolig/dp/3-vaerelses-lejlighed-koebenhavn-s/id-6045261,"Horisonten II er en ejendom i Ørestad, som blev opført i 2011. Ejendommen har et moderne udtryk med flot arkitektur og en helt unik beliggenhed centralt i Ørestad. Ejendommen er beliggende i gå afstand til Metroen og Amager Fælled. Derudover er der kort gå afstand til indkøbs muligheder, skole, daginstitution og grønne områder, hvor hele familien kan boltre sig.
Ejendommen byder på lyse og funktionelle boliger med praktisk rum-fordeling og god udsigt - enten til Bella-kvarteret, Fælleden eller Ørestad By. Lejlighederne byder på masser af lys gennem de store flotte vinduespartier. Køkkenet ligger i åben forbindelse med stuen og her er rigeligt med plads til et stort spisebord samt sofa-stue. Selve køkkenet er udført i gode materialer og der er masser af skabs- og bordplads. Der medfølger alt i hårde hvidevarer. Hele lejligheden er belagt med flotte trægulve. Badeværelset er holdt lyse fliser på både væg og gulv og hvide skabselementer. Her selvfølgelig muret bruseniche og vaskesøjle med både vaskemaskine og tørretumbler. 
Selve ejendommen består af tre længer, der danner et stort, åbent gårdrum. Det er tanken, at gårdrummet skal danne rammen om det fælles sociale liv i bebyggelsen. Nogle af facaderne er hvide, andre er beklædt med rødbrune eller sandfarvede teglsten. 
Alle lejlighederne har tilhørende altan eller terrasse samt opbevaringsrum (kælder/depotrum). I opgangen er der desuden elevator til rådighed.
Størrelsen på lejlighederne ligger mellem 85 m2 og 147 m2. 
Der kan ansøges om husdyrhold til én lille hund eller kat mod udlejers skriftlige godkendelse. 
*Bemærk at billederne ikke nødvendigvis er taget af/fra den pågældende bolig, og at udsigt m.v. derfor kan variere.",2020-10-20T12:37:39Z
2 værelses lejlighed på 83 m²,12200,"København S, Poul Hartlings Gade",https://www.boligportal.dk/lejebolig/dp/2-vaerelses-lejlighed-koebenhavn-s/id-6045185,"Udefra er Hekla Husene et markant, kontrastfyldt byggeri med hvide facader brudt af zinkkarnapper og rækværk på altaner. Væk fra haven er byggeriet robust og umiddelbart lukket for indkig. Havemuren lukker af ud mod Artillerivej og skaber en sikker, lukket have, hvor selv de mindste kan løbe omkring.

Hekla Husene ligger i Havnestad Syd tæt på Amager Fælleds imponerende store, grønne områder, som flere af boligerne har udsigt over. Gåafstand til havnen med gang- og cykelbro til Fisketorvet og Havneholmen på den anden side.",2020-10-20T12:37:39Z
2 værelses lejlighed på 83 m²,12500,"København S, Poul Hartlings Gade",https://www.boligportal.dk/lejebolig/dp/2-vaerelses-lejlighed-koebenhavn-s/id-6045149,"Udefra er Hekla Husene et markant, kontrastfyldt byggeri med hvide facader brudt af zinkkarnapper og rækværk på altaner. Væk fra haven er byggeriet robust og umiddelbart lukket for indkig. Havemuren lukker af ud mod Artillerivej og skaber en sikker, lukket have, hvor selv de mindste kan løbe omkring.

Hekla Husene ligger i Havnestad Syd tæt på Amager Fælleds imponerende store, grønne områder, som flere af boligerne har udsigt over. Gåafstand til havnen med gang- og cykelbro til Fisketorvet og Havneholmen på den anden side.",2020-10-20T12:37:39Z
2 værelses lejlighed på 75 m²,11800,"København S, Krimsvej",https://www.boligportal.dk/lejebolig/dp/2-vaerelses-lejlighed-koebenhavn-s/id-6045064,"Lejlighederne har en rummelig entré med indbygget skab, lyst spisekøkken med hårde hvidevarer og badeværelse med vaskemaskine og tørretumbler. Depotrum forefindes enten i lejlighed eller kælder. Lejlighederne har terrasse eller altan.

Strandpark Amager består af to ejendomme Ask og Birk og indeholder 184 lejligheder i høj kvalitet og består af to punkthuse på 14 og 15 etager kombineret med tre bygninger på mellem to og fem etager.

Du har alting lige ved hånden: Vand, strand, natur, sport og kultur. Du er tæt skoler, institutioner, metro, city, Øresundsbroen, lufthavnen, hyggelige caféer og take aways. De daglige indkøb klares nemt på Amager Strandvej, på Amagerbrogade eller i Danmarks største shopping-mekka Fields.",2020-10-20T12:37:39Z
2 værelses lejlighed på 87 m²,12096,"København S, Krimsvej",https://www.boligportal.dk/lejebolig/dp/2-vaerelses-lejlighed-koebenhavn-s/id-6045060,"Lejlighederne har en rummelig entré med indbygget skab, lyst spisekøkken med hårde hvidevarer og badeværelse med vaskemaskine og tørretumbler. Depotrum forefindes enten i lejlighed eller kælder. Lejlighederne har terrasse eller altan.

Strandpark Amager består af to ejendomme Ask og Birk og indeholder 184 lejligheder i høj kvalitet og består af to punkthuse på 14 og 15 etager kombineret med tre bygninger på mellem to og fem etager.

Du har alting lige ved hånden: Vand, strand, natur, sport og kultur. Du er tæt skoler, institutioner, metro, city, Øresundsbroen, lufthavnen, hyggelige caféer og take aways. De daglige indkøb klares nemt på Amager Strandvej, på Amagerbrogade eller i Danmarks største shopping-mekka Fields.",2020-10-20T12:37:39Z
2 værelses lejlighed på 69 m²,12395,"København S, Faste Batteri Vej",https://www.boligportal.dk/lejebolig/dp/2-vaerelses-lejlighed-koebenhavn-s/id-6044608,"Velkommen til Bryggehusene.
Bryggehusene består af i alt 262 boliger fordelt på 3 etaper. Helgagård, som denne ejendom hedder, er etape 1 af Bryggehusene og ejendommen stod klar til indflytning i 2019 og består af i alt 78 lejemål. 
Ejendommen er beliggende i 2300 København S - midt imellem Islands Brygge og DR Byen - et attraktivt, nyt grønt boligkvarter tæt på by og natur. Kvarteret er til dig, der foretrækker arkitektur af høj kvalitet, varieret bynatur og et aktivt fællesskab midt i byens puls. Her kan du leve et moderne familieliv i trygge rammer midt i det historiske København. Der er gode forbindelser til resten af byen med metroen, adskillige buslinjer, i bil og på cykel, ligesom der er rig mulighed for gode gåture, fx. på Fælleden. Boligkvarterets legende grønne cykelrute inviterer til daglige ture til resten af Islands Brygge, til byens rige kulturliv og til et aktivt friluftsliv i Naturpark Amager. Bryggens Bastion, som området også kaldes, bygger videre på det historiske fortidsminde Faste Batteri, der udgør et grønt åndehul, hvor både store og små kan mærke historiens vingesus – med udsigt til campuslivet på Københavns Universitet.  
Ejendommen er beliggende tæt på indkøbsmuligheder og ikke mindst et væld af daginstitutioner og skoler. På cykel eller gåben kommer du hurtigt og nemt til Firsketorvet via cykelbroen fra Islands Brygge. Hvis du istedet foretrækker Fields kommer du nemt dertil med Metroen eller på cykel langs Ørestad Boulevard. 
 
Lejlighederne fremstår rummelige og lyse med store vinduespartier, flotte egetræsgulve og udgang til altan eller terrasse. Alle lejligheder er udført med smukt moderne Svane køkken med alt i hårde hvidevarer og i åben forbindelse til stuen.
Husdyrhold er desværre ikke tilladt.
Lejlighederne er klar til indflytning snarest muligt eller efter aftale.
 
*Bemærk at billederne ikke nødvendigvis er taget af/fra den pågældende lejlighed, og at udsigt m.v. derfor kan variere.",2020-10-20T12:37:39Z
3 værelses lejlighed på 72 m²,11162,"København S, Else Alfelts Vej",https://www.boligportal.dk/lejebolig/dp/3-vaerelses-lejlighed-koebenhavn-s/id-6044259,"Nyopført ejendom med 2 og 3 værelses lejligheder samt rækkehuse.

Der er ikke flere 2 værelses lejligheder tilbage. 

Der er 3 værelses lejligheder tilbage i forskellige størrelser.

Ejendommen ligger i det naturskønne Ørestad Syd og i gåafstand til Vestamager metrostation.

Der er parkeringskælder i ejendommen og mulighed for, at leje en fast parkeringsplads for 750 kr. pr. måned.

For nøjagtig størrelse, plantegning og husleje, så kom til Åbent Hus og få et overblik over de forskellige muligheder.

Obs: Tilmelding til åbent hus virker ikke i boligportalens mobil app men kun ved at logge på via en internet browser.",2020-10-20T12:37:39Z
3 værelses lejlighed på 100 m²,12538,"København S, Else Alfelts Vej",https://www.boligportal.dk/lejebolig/dp/3-vaerelses-lejlighed-koebenhavn-s/id-6044256,"Nyopført ejendom med 2 og 3 værelses lejligheder samt rækkehuse.

Der er ikke flere 2 værelses lejligheder tilbage. 

Der er 3 værelses lejligheder tilbage i forskellige størrelser.

Ejendommen ligger i det naturskønne Ørestad Syd og i gåafstand til Vestamager metrostation.

Der er parkeringskælder i ejendommen og mulighed for, at leje en fast parkeringsplads for 750 kr. pr. måned.

For nøjagtig størrelse, plantegning og husleje, så kom til Åbent Hus og få et overblik over de forskellige muligheder.

Obs: Tilmelding til åbent hus virker ikke i boligportalens mobil app men kun ved at logge på via en internet browser.",2020-10-20T12:37:39Z
3 værelses lejlighed på 80 m²,12450,"København S, Richard Mortensens Vej",https://www.boligportal.dk/lejebolig/dp/3-vaerelses-lejlighed-koebenhavn-s/id-6043179,"Projektudlejning - Nordhuset

Velkommen til Nordhuset, som tilbyder dig nye, attraktive lejligheder for enhver smag. Vælg mellem 2, 3 eller 4 værelser. Eller hvad med en familiebolig i to etager med direkte udgang til terrasse og fantastisk gårdrum. Lige meget hvad du vælger får du en fantastisk udsigt over byen eller Kalvebod Fælled. 

Når du slår dig ned i Nordhuset, har du kort vej til alt. Her er masser af arbejdspladser, den populære Kalvebod Fælled Skole, børnehaver, vuggestuer og Ørestad Gymnasium. Du bor tæt på videregående uddannelser som Københavns Universitet og IT-Universitetet. Eller kulturelle oplevelser i Royal Arena, Koncerthuset og DR Byen. Du får det verdensberømte byggeri 8TALLET som din nabo og masser af indkøbsmuligheder lige uden for døren - og med Fields kun en kort cykeltur væk.

Og ikke mindst det enorme naturområde Kalvebod Fælled med et væld af muligheder for fritidsaktiviteter, hvad enten du er til løb, cykling eller leg i det fri.",2020-10-20T12:37:39Z
2 værelses lejlighed på 60 m²,11600,"København S, Strandlodsvej ",https://www.boligportal.dk/lejebolig/dp/2-vaerelses-lejlighed-koebenhavn-s/id-6043165,"En perle af en 2 værelses lejlighed på hele 60 kvm. Et dejligt stort soveværelse samt stuen i forbindelse med åben køkken hvor alt i hårde hvidevare er med. Endvidere stort badeværelse med vaskesøjle.
Lige til at rykke ind i.",2020-10-20T12:37:39Z
2 værelses lejlighed på 83 m²,12450,"København S, Krimsvej",https://www.boligportal.dk/lejebolig/dp/2-vaerelses-lejlighed-koebenhavn-s/id-6043153,"Lejlighederne har en rummelig entré med indbygget skab, lyst spisekøkken med hårde hvidevarer og badeværelse med vaskemaskine og tørretumbler. Depotrum forefindes enten i lejlighed eller kælder. Lejlighederne har terrasse eller altan.

Strandpark Amager består af to ejendomme Ask og Birk og indeholder 184 lejligheder i høj kvalitet og består af to punkthuse på 14 og 15 etager kombineret med tre bygninger på mellem to og fem etager.
Du har alting lige ved hånden: Vand, strand, natur, sport og kultur. Du er tæt skoler, institutioner, metro, city, Øresundsbroen, lufthavnen, hyggelige caféer og take aways. De daglige indkøb klares nemt på Amager Strandvej, på Amagerbrogade eller i Danmarks største shopping-mekka Fields.",2020-10-20T12:37:39Z
2 værelses lejlighed på 70 m²,11950,"København S, Else Alfelts Vej",https://www.boligportal.dk/lejebolig/dp/2-vaerelses-lejlighed-koebenhavn-s/id-6041434,"Projektudlejning - Nordhuset

Velkommen til Nordhuset, som tilbyder dig nye, attraktive lejligheder for enhver smag. Vælg mellem 2, 3 eller 4 værelser. Eller hvad med en familiebolig i to etager med direkte udgang til terrasse og fantastisk gårdrum. Lige meget hvad du vælger får du en fantastisk udsigt over byen eller Kalvebod Fælled. 

Når du slår dig ned i Nordhuset, har du kort vej til alt. Her er masser af arbejdspladser, den populære Kalvebod Fælled Skole, børnehaver, vuggestuer og Ørestad Gymnasium. Du bor tæt på videregående uddannelser som Københavns Universitet og IT-Universitetet. Eller kulturelle oplevelser i Royal Arena, Koncerthuset og DR Byen. Du får det verdensberømte byggeri 8TALLET som din nabo og masser af indkøbsmuligheder lige uden for døren - og med Fields kun en kort cykeltur væk.

Og ikke mindst det enorme naturområde Kalvebod Fælled med et væld af muligheder for fritidsaktiviteter, hvad enten du er til løb, cykling eller leg i det fri.",2020-10-20T12:37:39Z
2 værelses lejlighed på 59 m²,10800,"København S, Halldor Laxness Vej",https://www.boligportal.dk/lejebolig/dp/2-vaerelses-lejlighed-koebenhavn-s/id-6041199,"Lejlighederne
Organistens Hus rummer 2-6-værelses lejligheder i størrelsesorden fra 54 til 159 m2 - alle indrettet med rummelige planløsninger.  Alle boligerne er udstyret med klassiske køkkener fra HTH.  Badeværelserne er tilmed fra HTH og indeholder vaskesøjler.  Hårde hvidevarerne er fra Simens. 
 
Ejendommen
Boligkarrén Organistens Hus rummer i alt 81 lejemål - fra stueniveau til 9.  sal.  Ejendommens lejligheder varierer fra 2 til 6 værelse i størrelsen 54 - 159 m2.  De fleste af boligerne byder enten på en skøn altan, tagterrasse eller fransk altan.  Stuelejlighederne har enge terrasser.  Alle ejendommens beboer har desuden adgang til to fælles tagterrasser, begge beliggende på 4.  sal. 
 
Området
Med metroen er Nørreport station blot 10 minutter væk.  Derudover er ejendommens beliggenhed optimal, hvis du er på cykel, da du på kort tid kan fragte dig gennem Amager Fælleds naturskønne omgivelser til Islandsbrygge og resten af København.  Du har blot 600 meter til Field's shopping center, 200 meter til nærmeste daginstitution, 650 meter til Ørestad skole og 550 meter til Amager Fælled. 
 
Bemærk, billederne er fra en tidligere prøvebolig.",2020-10-20T12:37:39Z
