title,price,loc,link,desc,date
3 værelses lejlighed på 91 m²,12600,"København S, Asger Jorns Allé",https://www.boligportal.dk/lejebolig/dp/3-vaerelses-lejlighed-koebenhavn-s/id-6054309,"Lejligheden

Lejligheden fremstår lys og rummelig og er opført i klassiske og tidssvarende materialer. Stue og køkken ligger i forlængelse af hinanden og skaber et stort åbent rum der giver maksimalt udbytte af det fantastiske lysindfald. Det moderne og praktiske køkken er fra Invita og byder blandt andet på ’svævende’ bordplade med højtrykskomposit, LED-spots og integrerede hvidevarer – alle fra Siemens. Fra gangen har du adgang til det indbydende badeværelse med gulvvarme, formstøbt og integreret marmorvask, væghængt toilet samt vaskemaskine og tørretumbler. Det er muligt at ansøge om husdyrtilladelse i alle vores lejemål. Lejligheden råder desuden over en rummelig altan med værn i hærdet glas.

NB: billederne viser ikke den eksakte lejlighed, men er i stedet billeder fra en lejlighed med samme planløsning og i samme stand. Der kan forekomme mindre variationer i vindues-, altan- og radiatorplaceringer mellem boliger af samme type. Desuden kan udsigten variere, hvis typebilledet er taget fra en etage lidt højere oppe eller længere nede end den pågældende lejlighed. Derfor kræver vi altid, at du skal med ud på en fremvisning inden du kan underskrive en lejekontrakt, så du er helt sikker på, hvad du får.

Ejendommen

Lavetten er tegnet af den prisvindende tegnestue, Danielsen Architecture, der har skabt en ejendom med et moderne arkitektonisk udtryk. Ved at sænke bygningshøjden i det sydvestlige hjørne optimeres lysindfald og udsigt for alle beboere. Ejendommen er desuden karakteriseret ved det store, åbne gårdrum, der er inddelt i zoner med specifikke behov for øje, hvadend det er leg og bevægelse eller mere private zoner til ro og afslapning. I Lavetten får du en bæredygtig bolig i et energivenligt byggeri. Som eksempler kan nævnes bæredygtig regnvandshåndtering, kildesortering, lavenergiruder overalt samt hvidevarer i minimum energiklasse A+. Lavetten er en såkaldt lavenergibygning, der efterlever alle krav til isolering, ventilation og tæthed i energimærkningens A2020. Vi er tilmed 10% bedre. Listen over kvalitetsløsninger er lang og indbefatter desuden elevator til døren (dog ikke til de øverste dobbeltlejligheder), praktisk teknikskakt og mulighed for leje af p-plads i kælderen.

Omgivelser

Ørestad Syd er Københavns nye grønne bydel omgivet af natur og vand - og med en god blanding af boliger, erhverv, uddannelse og kultur. Området er kendetegnet ved sammenstødet mellem moderne arkitektur og Kalvebod Fælleds vidtstrakte natur. Kvarteret er i konstant udvikling og de tusindvis af nye beboere er med til at gøre Ørestad Syd til en bydel fuld af liv og aktivitet. Selvom den fredede natur ligger lige i baghaven, er man som beboer i Ørestad Syd meget tæt på Københavns midte og puls. På cykel eller med metro kan du være på Christianshavn på 11 minutter eller på Nørreport St. på 14 minutter. I Ørestad Syd har du dog adgang til alt hvad hjertet begærer, uden at forlade kvarteret. Foruden den storslåede natur, har du Danmarks største shopping center, Field’s, store kulturoplevelser i Royal Arena, caféliv, sportsklubber, skoler, børnehaver og indkøbsmuligheder lige uden for døren.",2020-10-16T18:46:30Z
4 værelses lejlighed på 135 m²,14895,"København S, Faste Batteri Vej",https://www.boligportal.dk/lejebolig/dp/4-vaerelses-lejlighed-koebenhavn-s/id-6054303,"Velkommen til Bryggehusene.
Bryggehusene består af i alt 262 boliger fordelt på 3 etaper. Helgagård, som denne ejendom hedder, er etape 1 af Bryggehusene og ejendommen stod klar til indflytning i 2019 og består af i alt 78 lejemål. 
Ejendommen er beliggende i 2300 København S - midt imellem Islands Brygge og DR Byen - et attraktivt, nyt grønt boligkvarter tæt på by og natur. Kvarteret er til dig, der foretrækker arkitektur af høj kvalitet, varieret bynatur og et aktivt fællesskab midt i byens puls. Her kan du leve et moderne familieliv i trygge rammer midt i det historiske København. Der er gode forbindelser til resten af byen med metroen, adskillige buslinjer, i bil og på cykel, ligesom der er rig mulighed for gode gåture, fx. på Fælleden. Boligkvarterets legende grønne cykelrute inviterer til daglige ture til resten af Islands Brygge, til byens rige kulturliv og til et aktivt friluftsliv i Naturpark Amager. Bryggens Bastion, som området også kaldes, bygger videre på det historiske fortidsminde Faste Batteri, der udgør et grønt åndehul, hvor både store og små kan mærke historiens vingesus – med udsigt til campuslivet på Københavns Universitet.  
Ejendommen er beliggende tæt på indkøbsmuligheder og ikke mindst et væld af daginstitutioner og skoler. På cykel eller gåben kommer du hurtigt og nemt til Firsketorvet via cykelbroen fra Islands Brygge. Hvis du istedet foretrækker Fields kommer du nemt dertil med Metroen eller på cykel langs Ørestad Boulevard. 
 
Lejlighederne fremstår rummelige og lyse med store vinduespartier, flotte egetræsgulve og udgang til altan eller terrasse. Alle lejligheder er udført med smukt moderne Svane køkken med alt i hårde hvidevarer og i åben forbindelse til stuen.
Husdyrhold er desværre ikke tilladt.
Lejlighederne er klar til indflytning snarest muligt eller efter aftale.
 
*Bemærk at billederne ikke nødvendigvis er taget af/fra den pågældende lejlighed, og at udsigt m.v. derfor kan variere.",2020-10-16T18:46:30Z
3 værelses lejlighed på 87 m²,12400,"København S, Richard Mortensens Vej",https://www.boligportal.dk/lejebolig/dp/3-vaerelses-lejlighed-koebenhavn-s/id-6054273,"Lejligheden

Lejligheden er indrettet med et stort alrum, hvor køkken og stue smelter sammen og skaber en rummelig atmosfære. De store vinduespartier trækker lys ind i lejligheden fra alle vinkler. Dertil er boligen udstyret med et moderne køkken fra Invita, hårde hvidevarer fra Bosch Siemens samt praktisk skabsplads i mastersoveværelset. Fra gangen har du adgang til det rummelige og indbydende badeværelse med gulvvarme, formstøbt marmorvask, væghængt toilet samt vaskesøjle. Fra stuen har du udgang til en stor møblérbar altan, der giver et privat pusterum med masser af sol, frisk luft og hygge. Det er muligt at ansøge om husdyrtilladelse i alle vores lejemål.

NB: da Bastionen er et nybyggeri, står alle lejemål ikke helt færdigbygget endnu. Billederne viser derfor ikke den pågældende lejlighed, men i stedet billeder fra prøveboligen. Billeder kan derfor bruges til at få en fornemmelse af stil og materialevalg. Ift. planløsning, henviser vi til plantegningen. Kom gerne forbi til et åbent hus eller ring og book en personlig fremvisning. Såfremt byggeprocessen er nået langt nok, kan vi nogle gange fremvise specifikke lejligheder udover blot prøveboligen.

Ejendommen

Bastionen er et spændende byggeri med en stærk arkitektonisk identitet, tegnet af de prisvindende arkitekter Danielsen Architecture. Her bydes du velkommen af de karakteristiske hængende haver der pryder ejendommens facade og leder ind i den grønne gårdhave. Den unikke beplantning fra det nærliggende Kalvebod Fælled er trukket ind i både gårdrum og på altaner, og er med til at mildne vinden og skabe en grøn oase. Det sydvestlige hjørne af Bastionen er bevidst bygget lavere end bygningens andre hjørner for at trække sol ind i gårdrummet og give mest mulig udsigt til den omkringliggende natur i Skovrummet og Fælleden. Det sænkede hjørne i den sydvestlige del af bygningen betyder også, at lejlighederne gennemstrømmes af dagslys. Gårdrummets frodige og varierende beplantning skaber både afslappende hyggekroge og perfekte naturlige legeomgivelser med høje klatretræer, små bakker og enggræs til gemmeleg. Gårdrummet byder også på et væksthus, en basketball bane samt et overdækket område til cykelparkering. Til ejendommen hører der desuden elevator, dørtelefon med kamera og mulighed for parkeringsplads i kælderen.

Omgivelser

Ørestad Syd er Københavns nye grønne bydel der ligger i grænselandet mellem natur og storby. Bydelen er præget af spændende og moderne byggerier tegnet af anerkendte danske og internationale arkitekter. Som beboer i Ørestad Syd har man Kalvebod Fælled lige uden for døren. Fælleden byder på enestående naturomgivelser med masser af plads til både løb, cykling, ridning, drageflyvning, rulleskøjteløb eller bare helt stille og rolige gåture. Dertil rummer Ørestad også masser af spisesteder samt et aktivt byliv og kulturelt miljø. Her bor du i gåafstand til både shopping i Field’s, store kulturelle og sportslige begivenheder i Royal Arena, adskillige sportsklubber og et enestående friluftsliv. Bastionen er også optimalt placeret i forhold til daginstitutioner, skoler, gymnasier og videregående uddannelser – og med metroen lige rundt og hjørnet kan du være på Kongens Nytorv på bare 14 minutter.",2020-10-16T18:46:30Z
4 værelses lejlighed på 95 m²,13800,"København S, Richard Mortensens Vej",https://www.boligportal.dk/lejebolig/dp/4-vaerelses-lejlighed-koebenhavn-s/id-6054268,"Lejligheden

Lejligheden er indrettet med et stort alrum, hvor køkken og stue smelter sammen og skaber en rummelig atmosfære. De store vinduespartier trækker lys ind i lejligheden fra alle vinkler. Dertil er boligen udstyret med et moderne køkken fra Invita, hårde hvidevarer fra Bosch Siemens samt praktisk skabsplads i mastersoveværelset. Fra gangen har du adgang til det rummelige og indbydende badeværelse med gulvvarme, formstøbt marmorvask, væghængt toilet samt vaskesøjle. Fra stuen har du udgang til en stor møblérbar altan, der giver et privat pusterum med masser af sol, frisk luft og hygge. Det er muligt at ansøge om husdyrtilladelse i alle vores lejemål.

NB: da Bastionen er et nybyggeri, står alle lejemål ikke helt færdigbygget endnu. Billederne viser derfor ikke den pågældende lejlighed, men i stedet billeder fra prøveboligen. Billeder kan derfor bruges til at få en fornemmelse af stil og materialevalg. Ift. planløsning, henviser vi til plantegningen. Kom gerne forbi til et åbent hus eller ring og book en personlig fremvisning. Såfremt byggeprocessen er nået langt nok, kan vi nogle gange fremvise specifikke lejligheder udover blot prøveboligen.

Ejendommen

Bastionen er et spændende byggeri med en stærk arkitektonisk identitet, tegnet af de prisvindende arkitekter Danielsen Architecture. Her bydes du velkommen af de karakteristiske hængende haver der pryder ejendommens facade og leder ind i den grønne gårdhave. Den unikke beplantning fra det nærliggende Kalvebod Fælled er trukket ind i både gårdrum og på altaner, og er med til at mildne vinden og skabe en grøn oase. Det sydvestlige hjørne af Bastionen er bevidst bygget lavere end bygningens andre hjørner for at trække sol ind i gårdrummet og give mest mulig udsigt til den omkringliggende natur i Skovrummet og Fælleden. Det sænkede hjørne i den sydvestlige del af bygningen betyder også, at lejlighederne gennemstrømmes af dagslys. Gårdrummets frodige og varierende beplantning skaber både afslappende hyggekroge og perfekte naturlige legeomgivelser med høje klatretræer, små bakker og enggræs til gemmeleg. Gårdrummet byder også på et væksthus, en basketball bane samt et overdækket område til cykelparkering. Til ejendommen hører der desuden elevator, dørtelefon med kamera og mulighed for parkeringsplads i kælderen.

Omgivelser

Ørestad Syd er Københavns nye grønne bydel der ligger i grænselandet mellem natur og storby. Bydelen er præget af spændende og moderne byggerier tegnet af anerkendte danske og internationale arkitekter. Som beboer i Ørestad Syd har man Kalvebod Fælled lige uden for døren. Fælleden byder på enestående naturomgivelser med masser af plads til både løb, cykling, ridning, drageflyvning, rulleskøjteløb eller bare helt stille og rolige gåture. Dertil rummer Ørestad også masser af spisesteder samt et aktivt byliv og kulturelt miljø. Her bor du i gåafstand til både shopping i Field’s, store kulturelle og sportslige begivenheder i Royal Arena, adskillige sportsklubber og et enestående friluftsliv. Bastionen er også optimalt placeret i forhold til daginstitutioner, skoler, gymnasier og videregående uddannelser – og med metroen lige rundt og hjørnet kan du være på Kongens Nytorv på bare 14 minutter.",2020-10-16T18:46:30Z
3 værelses lejlighed på 85 m²,13500,"København S, Øresundsvej",https://www.boligportal.dk/lejebolig/dp/3-vaerelses-lejlighed-koebenhavn-s/id-6054237,"Lejligheden

Lejligheden er opført i skandinavisk stil, der får den til at fremstå moderne, lys og indbydende. De store vinduer lukker store mængder dagslys ind og skaber derved en varm atmosfære og et flot spil på det lyse egetræsgulv. Lejlighedens hjerte er et centralt opholdsrum med åbent køkken og spiseplads. Det diskrete, hvide køkken er fra Invita med hårde hvidevarer fra Siemens. På badeværelset er der fliser på gulvet og i brusekabinen. Der er desuden vaskemaskine og tørretumbler fra Siemens. I mastersoveværelset findes indbyggede skabe til opbevaring. Lejligheden råder over nordvendt altan med trædæk, hvorfra du kan nyde områdets liv og summen. Stue og soveværelser er vestvendte og ind mod gårdmiljø. Det er muligt at ansøge om husdyrstilladelse i alle vores lejemål.

NB: billederne viser ikke den eksakte lejlighed, men er i stedet billeder fra en lejlighed med samme planløsning og i samme stand. Der kan forekomme mindre variationer i vindues-, altan- og radiatorplaceringer mellem boliger af samme type. Desuden kan udsigten variere, hvis typebilledet er taget fra en etage lidt højere oppe eller længere nede end den pågældende lejlighed. Derfor kræver vi altid, at du skal med ud på en fremvisning inden du kan underskrive en lejekontrakt, så du er helt sikker på, hvad du får.

Ejendommen

Øresund Park består af fem bygninger, som er bundet sammen af grønne, åbne gårdrum, hvilket gør det muligt at bevæge sig frit rundt imellem bygningerne. Her skabes solrige, rekreative områder med plads til både fællesskaber, leg og stille fordybelse. Ejendommen blev opført i 2018, er tegnet af Henning Larsen Architects og udført i mursten, der med et flot farvespil og spring i facadeelementer skaber en smuk og varierende facadekomposition. Der er bygget med omtanke, hvorved byggeriet er yderst energieffektivt – der er blandt andet solcelleanlæg på taget og alle boliger lever op til energimærkning A2020. Der er etableret parkeringskælder under ejendommen med mulighed for leje af privat p-plads. Ejendommen byder desuden på elevator, affaldsskakt og dørtelefon med kamera.

Omgivelserne

Området omkring Øresund Park har gennemgået en stor forvandling de seneste år, underbygget af etableringen af de fantastiske naturområder ved Amager Strandpark. Samtidig binder Øresund metrostation den nye bydel sammen med resten af byen. Herfra kan du på bare 7 minutter komme til Kgs. Nytorv og på 6 minutter er du i Københavns lufthavn.

Amager Strandpark, der blot er 5 minutters gåtur væk, byder på kilometervis af den fineste badestrand. Her kan du desuden både spille minigolf, beachvolley eller udnytte de fantastiske forhold til kitesurfing. Bevæger du dig langs vandkanten, kommer du til kajakklubben og lystbådehavnen. Der er flere større dagligvarebutikker, fitnessmuligheder samt hyggelige restauranter og caféer i nærområdet. Har du børn, ligger der flere daginstitutioner og skoler tæt på. Så det vil være nemt at få logikken til at gå op, når de mindste skal afleveres og hentes.",2020-10-16T18:46:30Z
3 værelses lejlighed på 84 m²,13800,"København S, Strandlodsvej",https://www.boligportal.dk/lejebolig/dp/3-vaerelses-lejlighed-koebenhavn-s/id-6054234,"Lejligheden

Lejligheden er opført i skandinavisk stil, der får den til at fremstå moderne, lys og indbydende. De store vinduer lukker store mængder dagslys ind og skaber derved en varm atmosfære og et flot spil på det lyse egetræsgulv. Lejlighedens hjerte er et centralt opholdsrum med åbent køkken og spiseplads. Det diskrete, hvide køkken er fra Invita med hårde hvidevarer fra Siemens. På badeværelset er der fliser på gulvet og i brusekabinen. Der er desuden vaskemaskine og tørretumbler fra Siemens. I mastersoveværelset findes indbyggede skabe til opbevaring. Lejligheden råder over nordvendt altan med trædæk, hvorfra du kan nyde områdets liv og summen. Stue og soveværelser er vestvendte og ind mod gårdmiljø. Det er muligt at ansøge om husdyrstilladelse i alle vores lejemål.

NB: billederne viser ikke den eksakte lejlighed, men er i stedet billeder fra en lejlighed med samme planløsning og i samme stand. Der kan forekomme mindre variationer i vindues-, altan- og radiatorplaceringer mellem boliger af samme type. Desuden kan udsigten variere, hvis typebilledet er taget fra en etage lidt højere oppe eller længere nede end den pågældende lejlighed. Derfor kræver vi altid, at du skal med ud på en fremvisning inden du kan underskrive en lejekontrakt, så du er helt sikker på, hvad du får.

Ejendommen

Øresund Park består af fem bygninger, som er bundet sammen af grønne, åbne gårdrum, hvilket gør det muligt at bevæge sig frit rundt imellem bygningerne. Her skabes solrige, rekreative områder med plads til både fællesskaber, leg og stille fordybelse. Ejendommen blev opført i 2018, er tegnet af Henning Larsen Architects og udført i mursten, der med et flot farvespil og spring i facadeelementer skaber en smuk og varierende facadekomposition. Der er bygget med omtanke, hvorved byggeriet er yderst energieffektivt – der er blandt andet solcelleanlæg på taget og alle boliger lever op til energimærkning A2020. Der er etableret parkeringskælder under ejendommen med mulighed for leje af privat p-plads. Ejendommen byder desuden på elevator, affaldsskakt og dørtelefon med kamera.

Omgivelserne

Området omkring Øresund Park har gennemgået en stor forvandling de seneste år, underbygget af etableringen af de fantastiske naturområder ved Amager Strandpark. Samtidig binder Øresund metrostation den nye bydel sammen med resten af byen. Herfra kan du på bare 7 minutter komme til Kgs. Nytorv og på 6 minutter er du i Københavns lufthavn.

Amager Strandpark, der blot er 5 minutters gåtur væk, byder på kilometervis af den fineste badestrand. Her kan du desuden både spille minigolf, beachvolley eller udnytte de fantastiske forhold til kitesurfing. Bevæger du dig langs vandkanten, kommer du til kajakklubben og lystbådehavnen. Der er flere større dagligvarebutikker, fitnessmuligheder samt hyggelige restauranter og caféer i nærområdet. Har du børn, ligger der flere daginstitutioner og skoler tæt på. Så det vil være nemt at få logikken til at gå op, når de mindste skal afleveres og hentes.",2020-10-16T18:46:30Z
4 værelses lejlighed på 97 m²,13195,"København S, Ejler Billes Allé",https://www.boligportal.dk/lejebolig/dp/4-vaerelses-lejlighed-koebenhavn-s/id-6054213,"Arenahusene består af i alt 55 lejligheder. 25 af dem er fordelt i A-tårnet, hvor de ligger fra stue til 8. sal. Herudover findes 2 punkthuse med hver 15 lejligheder. Lejlighederne er lyse og rummelige og er i størrelsen 59-144 m2. Her kan du nyde freden, udsigten og fællesskabet i Arenakvarteret.
Ejendommen er opført i naturfarvede nuancer og med et moderne udtryk, der kommer gennemsyrer hele byggeriet fra fællesarealer til planløsning og indvendigt materialevalg. 
Placeringen i direkte relation til Kalvebod Fælled og nær metroen til Københavns Centrum, skaber et særligt boligområde, der henvender sig til et aldersmæssigt bredt publikum.
*Bemærk at billederne ikke nødvendigvis er taget af/fra den pågældende bolig, og at udsigt m.v. derfor kan variere.",2020-10-16T18:46:30Z
3 værelses lejlighed på 93 m²,12700,"København S, Richard Mortensens Vej",https://www.boligportal.dk/lejebolig/dp/3-vaerelses-lejlighed-koebenhavn-s/id-6054189,"Projektudlejning - Nordhuset

Velkommen til Nordhuset, som tilbyder dig nye, attraktive lejligheder for enhver smag. Vælg mellem 2, 3 eller 4 værelser. Eller hvad med en familiebolig i to etager med direkte udgang til terrasse og fantastisk gårdrum. Lige meget hvad du vælger får du en fantastisk udsigt over byen eller Kalvebod Fælled. 

Når du slår dig ned i Nordhuset, har du kort vej til alt. Her er masser af arbejdspladser, den populære Kalvebod Fælled Skole, børnehaver, vuggestuer og Ørestad Gymnasium. Du bor tæt på videregående uddannelser som Københavns Universitet og IT-Universitetet. Eller kulturelle oplevelser i Royal Arena, Koncerthuset og DR Byen. Du får det verdensberømte byggeri 8TALLET som din nabo og masser af indkøbsmuligheder lige uden for døren - og med Fields kun en kort cykeltur væk.

Og ikke mindst det enorme naturområde Kalvebod Fælled med et væld af muligheder for fritidsaktiviteter, hvad enten du er til løb, cykling eller leg i det fri.",2020-10-16T18:46:30Z
2 værelses lejlighed på 77 m²,13600,"København Ø, Viborggade",https://www.boligportal.dk/lejebolig/dp/2-vaerelses-lejlighed-koebenhavn-oe/id-6054186,"God beliggenhed på Østerbro, med lukket fælleshave, egen terrasse, godt badeværelse med vaskesøjle, mindre soveværelse og et lille værelse eventuelt som børneværelse/kontor. 

Flot køkkenalrum, som indeholder køle-/fryseskab, emhætte, komfur og opvaskemaskine og god skabsplads. Stuen er i åben forbindelse til køkkenet, med fin plads til sofaarrangement, derudover direkte udgang til egen privat terrasse.  

Et godt lejemål med indflytning omkring start januar 2021.
Nuværende lejere bor der fortsat, men fremvisninger kan sagtens arrangeres.  

vi foretrækker skriftlige henvendelser her på boligportalen. HUSK at skrive lidt om dig/jer selv, tlf.nummer - så vi kan kontakte jer.",2020-10-16T18:46:30Z
3 værelses lejlighed på 91 m²,13500,"København S, Øresundsvej",https://www.boligportal.dk/lejebolig/dp/3-vaerelses-lejlighed-koebenhavn-s/id-6054167,"Lejligheden

Lejligheden er opført i skandinavisk stil, der får den til at fremstå moderne, lys og indbydende. De store vinduer lukker store mængder dagslys ind og skaber derved en varm atmosfære og et flot spil på det lyse egetræsgulv. Lejlighedens hjerte er et centralt opholdsrum med åbent køkken og spiseplads. Det diskrete, hvide køkken er fra Invita med hårde hvidevarer fra Siemens. På badeværelset er der fliser på gulvet og i brusekabinen. Der er desuden vaskemaskine og tørretumbler fra Siemens. I mastersoveværelset findes indbyggede skabe til opbevaring. Lejligheden råder over nordvendt altan med trædæk, hvorfra du kan nyde områdets liv og summen. Stue og soveværelser er vestvendte og ind mod gårdmiljø. Det er muligt at ansøge om husdyrstilladelse i alle vores lejemål.

NB: billederne viser ikke den eksakte lejlighed, men er i stedet billeder fra en lejlighed med samme planløsning og i samme stand. Der kan forekomme mindre variationer i vindues-, altan- og radiatorplaceringer mellem boliger af samme type. Desuden kan udsigten variere, hvis typebilledet er taget fra en etage lidt højere oppe eller længere nede end den pågældende lejlighed. Derfor kræver vi altid, at du skal med ud på en fremvisning inden du kan underskrive en lejekontrakt, så du er helt sikker på, hvad du får.

Ejendommen

Øresund Park består af fem bygninger, som er bundet sammen af grønne, åbne gårdrum, hvilket gør det muligt at bevæge sig frit rundt imellem bygningerne. Her skabes solrige, rekreative områder med plads til både fællesskaber, leg og stille fordybelse. Ejendommen blev opført i 2018, er tegnet af Henning Larsen Architects og udført i mursten, der med et flot farvespil og spring i facadeelementer skaber en smuk og varierende facadekomposition. Der er bygget med omtanke, hvorved byggeriet er yderst energieffektivt – der er blandt andet solcelleanlæg på taget og alle boliger lever op til energimærkning A2020. Der er etableret parkeringskælder under ejendommen med mulighed for leje af privat p-plads. Ejendommen byder desuden på elevator, affaldsskakt og dørtelefon med kamera.

Omgivelserne

Området omkring Øresund Park har gennemgået en stor forvandling de seneste år, underbygget af etableringen af de fantastiske naturområder ved Amager Strandpark. Samtidig binder Øresund metrostation den nye bydel sammen med resten af byen. Herfra kan du på bare 7 minutter komme til Kgs. Nytorv og på 6 minutter er du i Københavns lufthavn.

Amager Strandpark, der blot er 5 minutters gåtur væk, byder på kilometervis af den fineste badestrand. Her kan du desuden både spille minigolf, beachvolley eller udnytte de fantastiske forhold til kitesurfing. Bevæger du dig langs vandkanten, kommer du til kajakklubben og lystbådehavnen. Der er flere større dagligvarebutikker, fitnessmuligheder samt hyggelige restauranter og caféer i nærområdet. Har du børn, ligger der flere daginstitutioner og skoler tæt på. Så det vil være nemt at få logikken til at gå op, når de mindste skal afleveres og hentes.",2020-10-16T18:46:30Z
